question,document,answer_score,answer_reasoning,trajectory_score,trajectory_reasoning
"I just found this course — am I still allowed to join, or is it too late?",74eb249bbf,good,"The agent’s answer matches the ground truth. It correctly says the student can still join the course and includes the important caveat that to receive a certificate, the project must be submitted while submissions are still being accepted.",good,"The search query was relevant to the question about whether it is too late to join a course. It included key concepts like late, join, course, and FAQ, and only one search was needed. The tool call reasonably supported the final answer."
"If I join now, can I still get a certificate somehow?",74eb249bbf,good,"The agent’s answer matches the key point of the ground truth: joining now can still allow you to get a certificate, but only if you submit your project before submissions close. It adds extra details about homework, peer review, and self-paced mode, but these do not conflict with the original answer and the main requirement is preserved.",good,"The search query was relevant to the question and included the important keywords about certificates, joining now, and eligibility. Only one search was used, which is reasonable for this straightforward question. The tool call supported the final answer."
What do I need to do to qualify for the certificate if I’m starting late?,74eb249bbf,good,"The agent’s answer includes the core requirement from the ground truth: if starting late, you can still qualify for the certificate as long as you submit your project while submissions are still being accepted. It adds extra details about homework, capstone, live cohort, and peer review that are not present in the original answer, but these do not contradict the key point asked.",good,"The single search query was relevant to the question and included important keywords like certificate, starting late, and requirements. One search call is reasonable for this simple FAQ lookup, and the tool use supports the final answer."
Is there a deadline for submitting the project if I want the certificate?,74eb249bbf,good,"The agent’s answer matches the core ground-truth: to get the certificate, the project must be submitted while submissions are still being accepted. It adds extra details about no deadline extension, form closure, and live cohort/peer review that are not in the original answer, but they do not contradict the key point. So the answer is correct overall.",good,"The search query was relevant and contained key terms from the question: deadline, submitting project, certificate. Only one search was needed, and it reasonably supported the final answer without unnecessary duplicate calls."
"Can I enroll after the course has already started, and still count my project for certification?",74eb249bbf,good,"The agent’s answer is broadly consistent with the ground truth: it says late enrollment is possible and emphasizes that the project must be submitted before the course/cohort stops accepting work for certification. However, it adds extra specifics about self-paced mode, peer reviews, and live cohort rules that are not present in the original answer. These additions do not contradict the ground truth, but the key idea from the FAQ is that certification requires submitting the project while submissions are still being accepted, which the agent does convey.",good,"The search query was relevant to the question and included the main concepts of enrolling after the course starts and project/certification. Only one search was used, which is reasonable for a straightforward FAQ lookup. The query was not overly broad or duplicated, and it supported the final answer."
"Do I actually need a confirmation email to join the LLM Zoomcamp, or am I already accepted?",977bf7786c,good,"The agent answer matches the ground truth. It clearly states that a confirmation email is not needed, the student is already accepted, and that registration is only for gauging interest. It also correctly notes that one can start learning and submit homework while the form is open without registering, and that there is no check against a registered list.",good,"The tool call was relevant and included key terms from the question such as LLM Zoomcamp, confirmation email, and accepted. Only one search was needed, and the query was reasonable for verifying the FAQ answer. No unnecessary duplicate calls were made."
"If I registered for the course, do I have to wait for an email before I can start the lessons and homework?",977bf7786c,good,"The agent answer matches the ground truth. It correctly states that no confirmation email is needed, registered students are accepted, they can start lessons and submit homework when the form is open, and registration is only to gauge interest. It omits the extra detail that even unregistered students can participate while the form is open, but that is not required for the core answer.",good,"The single search query is directly relevant and includes the key ideas from the question: registration, waiting for email, lessons, and homework. One search was sufficient, and there were no redundant calls."
"Is there some approved list I need to be on, or can anyone just begin submitting homework while registration is open?",977bf7786c,good,"The agent answer matches the ground truth. It correctly says there is no approved list, anyone can start learning and submitting homework while the form is open, and registration is only to gauge interest before the start date and is not checked against a registered list.",good,"The search query was relevant and included key terms from the question about an approved list, submitting homework, and registration being open. Only one search was needed, and it directly supported the final answer."
What’s the point of the registration form if the course doesn’t check who registered?,977bf7786c,good,"The agent answer matches the ground truth closely. It correctly says the form is mainly to gauge interest, that it is not checked against an approved list, and that learners can still start learning and submit homework while the form is open even without registering. This preserves the key meaning of the original answer.",good,"The search query was relevant and included the core terms from the question about the registration form and whether registrations are checked. Only one search was needed, which is reasonable for this simple FAQ-style question. The tool call supported the final answer."
Can I start learning and turning in assignments right away without getting any extra confirmation after signing up?,977bf7786c,good,"The agent answer matches the ground truth well. It correctly says the user can start learning and submitting homework right away, that no extra confirmation is needed, and that registration is only to gauge interest and not checked against a registered list. This captures the key points of the original answer, though it omits the detail that they can even do so without registering while the form is open.",good,"The search query was relevant and included important keywords from the question such as starting learning, turning in assignments, and confirmation after signing up. Only one search was used, which is reasonable for a straightforward FAQ lookup. There were no unnecessary or duplicate tool calls."
Where do students actually join the office hours or live workshop if the Zoom link isn’t public?,489dd1c9d9,good,"The agent answer matches the ground truth. It correctly says the Zoom link is only for instructors/presenters/TAs, and that students join via YouTube Live and ask questions through Slido. It also correctly mentions the announcements channel on Telegram/Slack and the DataTalksClub YouTube channel. The only omission is the explicit warning not to post questions in chat, but the core answer is present.",good,"The single search query is relevant and includes the key idea of the question (office hours/live workshop and Zoom link visibility). One search is reasonable here, and the result clearly supported the final answer. No unnecessary repeated calls."
How can I ask questions during the live sessions if I’m not in the Zoom room?,489dd1c9d9,good,"The agent answer matches the ground truth well. It correctly says that students should use Slido to ask questions, that the Slido link is pinned in the live chat, that the session can be watched on YouTube Live, and that the announcements channel on Telegram or Slack posts the live video link. It also includes the warning not to post questions in chat. This contains the key information from the original answer, with no meaningful omissions.",good,"The single search query is relevant to the question and includes the main intent about asking questions during live sessions outside Zoom. One search is reasonable here, and there were no unnecessary duplicate calls. The tool use supported the final answer adequately."
"Will the office hours stream link be shared somewhere before it starts, and where should I look for it?",489dd1c9d9,good,"The agent answer matches the ground truth on the key points: the stream/video URL is posted in the announcements channel on Telegram and Slack before it begins, students can watch on the DataTalksClub YouTube channel, the Zoom link is only for instructors/presenters/TAs, and students use Slido for questions. It omits the warning about not posting questions in chat, but that is extra detail rather than core to the question.",good,"The single search query was relevant and used the main concepts from the question (office hours, stream link, shared before it starts, where to look). One search was reasonable and there were no unnecessary or duplicate tool calls. The query adequately supported the final answer."
"Can I watch the live workshop on YouTube, or is it only for instructors and TAs?",489dd1c9d9,good,"The agent answer matches the ground truth well. It correctly says students can watch via the DataTalksClub YouTube channel/YouTube Live, that the Zoom link is only for instructors/presenters/TAs, that the video URL is posted in Telegram/Slack announcements, and that questions should go through Slido rather than chat. This preserves the key information from the original answer.",good,"The single search query was relevant and contained important keywords from the question (live workshop, YouTube, instructors, TAs). One search was sufficient, and there were no unnecessary or duplicate calls."
"Should I use the chat to ask questions during office hours, or is there a better place to submit them?",489dd1c9d9,good,"The agent answer matches the key points of the ground truth: students should not rely on chat because messages can be missed, and questions should be submitted via Slido during live sessions. It also adds a general Slack note, which is not contradicted by the ground truth and is reasonable context, though the original answer specifically mentions Slack/Telegram/YouTube for live session access rather than general course help. Overall, the main answer is correct.",good,"The search query was relevant to the question and included the core concepts of office hours, chat, and submitting questions. Only one search call was made, which is reasonable for a straightforward FAQ lookup. The tool call supported the final answer."
"Where should I begin if I’m just starting LLM Zoomcamp, and what pages or repo should I look at first?",04919992b3,good,"The agent answer matches the ground truth closely. It correctly identifies the three starting resources: the LLM Zoomcamp docs, the general Zoomcamp logistics docs, and the LLM Zoomcamp GitHub repository. It also includes the typical workflow of watching videos, working through notebooks/code, reading homework instructions on GitHub, and submitting through the course platform. The extra note about the repo being the main entry point and the offer to point to Module 1 are not in the ground truth, but they do not contradict it. One minor omission is that the ground truth explicitly mentions that students can start whenever they want and that deadlines are listed on the course management platform; the agent partially covers this by mentioning the course platform but not the flexible start/deadline detail. Overall, the substantive answer is correct.",good,"The single search query was relevant and directly quoted the user’s question. Since the question was straightforward and likely answerable from course FAQ knowledge, one search is reasonable. There were no unnecessary duplicate calls, and the query contained the key terms from the question. The tool call supports the final answer."
"What’s the usual weekly routine for this course — do I watch the lecture first, then do notebooks, then homework?",04919992b3,good,"The agent’s answer matches the ground truth key points: it gives the same typical workflow order (watch videos, work through notebooks/code, read homework instructions, submit before the deadline) and confirms the student’s understanding. It omits the extra contextual details about starting anytime and the specific docs/repository links, but those were not required to answer the question. Overall, the answer is correct.",good,"The single search query was relevant to the question and included the main concepts (lecture, notebooks, homework, order). One search is reasonable here, and there were no unnecessary duplicate calls. The tool call supported the final answer adequately."
"Can I join and start the course at any time, or is there a fixed start date I need to wait for?",04919992b3,good,"The agent's answer matches the ground truth. It correctly says the course can be started whenever you want, that videos and GitHub materials are available, and that homework deadlines are on the course management platform. It also preserves the nuance that homework submissions depend on the form being open. This is consistent with the original answer's key points.",good,"The single search query was relevant to the user's question and used core keywords about starting anytime vs a fixed start date. One search is reasonable here, and there were no unnecessary duplicate calls. The tool use supports the final answer."
Where do I check the deadlines and submit my homework answers for LLM Zoomcamp?,04919992b3,good,"The agent answer matches the ground truth on the key point: deadlines and homework answers are handled via the LLM Zoomcamp course management platform, and it includes the correct URL. It also correctly mentions that homework instructions are on GitHub, which is consistent with the original answer. It omits some extra context from the ground truth (docs links, start whenever you want, typical workflow), but the essential information is present.",good,"The search query was directly relevant and included the main keywords from the question (LLM Zoomcamp, deadlines, submit homework answers). Only one search call was made, which is reasonable for this simple lookup. The tool call supported the final answer well."
"Is the homework basically the same as the lesson work, or does it use a different dataset/task?",04919992b3,good,The agent answer matches the ground truth key point: homework follows the lesson workflow but uses a different dataset or slightly different task. It is concise but accurate and preserves the main distinction asked in the question.,good,"The search query was relevant to the question and included the key concepts of homework, lesson work, dataset, and task. Only one search call was made, which is reasonable for a straightforward FAQ-style question. The tool call supported the final answer."
How can I find my own entry on the leaderboard if I’m not sure which one is mine?,c2903069a0,good,"The agent’s answer matches the ground truth well. It correctly says users are assigned a random name like “Lucid Elbakyan,” and that they should click the “Jump to your record on the leaderboard” link to find their entry. It also correctly mentions the Edit Course Profile fields and their purposes, including the public nickname and official name for the certificate. Minor detail: it omits that the official name is mandatory if the user does not want “Lucid Elbakyan” on the certificate, but the key information is present.",good,"The search query was relevant to the question and included the main concepts: finding one’s own leaderboard entry. Only one search call was needed, which is reasonable. The tool use supported the final answer."
"Why do I see a random name on the leaderboard, and can I change it?",c2903069a0,good,"The agent answer matches the ground truth well. It correctly explains that the random leaderboard name is the default public display name, that it is assigned automatically, and that it can be changed in Edit Course Profile. It also correctly distinguishes the first field as the leaderboard/display nickname and the second field as the official certificate name. The only omission is the specific instruction about clicking the ""Jump to your record on the leaderboard"" link to find your entry, but that is extra detail rather than essential to the question.",good,"The single search query was relevant and included key concepts from the question such as random name, leaderboard, change name, and display name. One search was sufficient, and there were no unnecessary duplicate calls. The query supported the final answer appropriately."
Where do I check what my displayed name is in the course profile?,c2903069a0,good,"The agent answer matches the ground truth on the key point: you check your displayed name by clicking 'Edit Course Profile,' and the first field is the display name/nickname. It omits extra details about the random assigned name and the certificate name, but those were not required to answer the question.",good,"The search query was relevant and included the main concepts from the question ('displayed name' and 'course profile'). Only one search was used, which is reasonable for this straightforward question."
"If I want my certificate to show my real name instead of the default nickname, what should I update?",c2903069a0,good,The agent correctly identified that the certificate name is controlled by the second field in Edit Course Profile and that this should be your official/legal name. This matches the ground truth key point. It also correctly distinguished the first field as the nickname/display name. The answer is complete enough and accurate.,good,"The single search query was relevant and contained the core concepts: certificate, real name, default nickname, update name, profile, and legal name. One search is reasonable here, and there were no unnecessary duplicate calls. The tool use supports the final answer."
"Can I use a Slack or GitHub handle as my course name, and which name ends up on the certificate?",c2903069a0,good,"The agent’s answer matches the ground truth. It correctly says a Slack/GitHub handle can be used as the display/public name, while the certificate uses the official name from the second field in Edit Course Profile. It also captures the important warning that the certificate should have the official/legal name rather than the nickname. Minor wording differences do not change the substance.",good,"The single search query was relevant and included key terms from the question (Slack, GitHub handle, course name, certificate name). Only one search was needed to support the answer, so the tool usage was reasonable and not excessive."
"Can I take the course on my own schedule and still get the certificate, or is it only for the live cohort?",69d122f12e,good,"The agent’s answer matches the ground truth. It correctly states that self-paced participation is allowed but does not lead to a certificate, and that certificates are only awarded for completing the course with a live cohort because peer-review of 3 capstone projects is required during the active course period.",good,"The single search query was relevant and included key concepts from the question such as self-paced, certificate, and live cohort. One search was sufficient, and there were no unnecessary or duplicate tool calls."
"If I study the course self-paced, will I be able to receive a certificate at the end?",69d122f12e,good,"The agent's answer matches the ground truth key points: no certificate for self-paced study, certificates only for finishing with a live cohort, and the reason is the required peer-review activity during the active course period. It omits the detail about needing to peer-review 3 capstones and the form being closed afterward, but the core answer is correct.",good,"The search query was relevant to the question and included key terms like self-paced and certificate. Only one search was needed, and it was reasonable for this FAQ-style question. The tool call supported the final answer."
Why don’t you give certificates for the self-paced version of the course?,69d122f12e,good,"The agent answer matches the ground truth. It says certificates are only awarded for finishing with a live cohort, and explains that self-paced learners do not receive certificates because the course requires peer-reviewing 3 capstone projects, which can only be done while the course is actively running. This captures the key information from the original answer.",good,"The search query closely matched the user’s question and was relevant. Only one search call was used, which is reasonable for a straightforward FAQ-style question. The tool call supported the final answer and there were no unnecessary or duplicate searches."
Do I have to finish the course while it’s running live to qualify for a certificate?,69d122f12e,good,"The agent’s answer matches the ground truth. It correctly says a certificate requires finishing with a live cohort, not self-paced, and mentions the peer-review requirement of 3 capstones during the active course. The only minor issue is the opening 'Yes' is a bit less precise than the original phrasing, but the substantive content is correct.",good,"The single search query used key terms from the question ('certificate', 'live', 'course') and was relevant. One search was sufficient, with no unnecessary duplication or refinement needed. The tool call reasonably supported the final answer."
"Is the peer-review part required for getting the certificate, and can that be done after the course ends?",69d122f12e,good,"The agent’s answer matches the ground truth. It correctly states that peer review is required for the certificate, that 3 capstones must be peer-reviewed, that this can only be done while the course is running, and that self-paced learners cannot get a certificate. It also correctly indicates that it cannot be done after the course ends.",good,"The single search query was relevant to the question and contained the core keywords about peer review, certificates, and after-course timing. One search was sufficient, and the tool use supported the final answer."
Do I still qualify for the certificate if I missed the first homework?,9f689c185f,good,"The agent answer matches the ground truth: it states that missing the first homework does not affect certificate eligibility, that passing the Capstone project is what matters, and that homework is optional but helps reinforce concepts and counts toward leaderboard rank. This preserves the key information accurately.",good,"The single search query is relevant and includes the main keywords from the question and answer theme: certificate, homework requirement, and qualification. One search call is sufficient here, and there are no unnecessary duplicates or misdirected queries."
Is the Capstone project enough to get the course certificate?,9f689c185f,bad,"The agent’s answer is mostly aligned with the ground truth on the main point: the Capstone project is required and homework is not mandatory. However, it adds several extra claims not present in the original answer, especially the requirement to complete peer reviews and the live cohort/self-paced distinction. Since the task is to match the FAQ answer, these unsupported additions make it not fully correct.",good,"The search query used the main keywords from the question and was relevant. Only one search call was made, which is reasonable. However, the final answer introduced details that were not supported by the ground truth, so while the trajectory was acceptable, it did not fully support a correct response."
"Are homework assignments required for certification, or are they optional?",9f689c185f,bad,"The agent did not match the ground truth. The correct answer says homework is not mandatory, but the Capstone project must be passed to get the certificate. The agent instead said it could not find an explicit FAQ entry and only provided unrelated workflow details. It missed the key certification requirement and the fact that homework is optional.",good,"The search query was relevant to the question and used the key terms 'homework', 'required', 'certification', and 'optional'. Only one search was made, which is reasonable, though the result handling did not lead to the correct answer. Still, the tool usage itself was appropriate."
"If homework isn't mandatory, what do those points actually affect?",9f689c185f,good,"The agent’s answer matches the ground truth. It correctly states that homework is not mandatory, that you need to pass the Capstone project to get the certificate, and that homework points count toward leaderboard rank only. This preserves the key information in the original answer.",good,"The single search query was relevant and included the key concepts from the question: homework optional, points, and what they affect. One search call is reasonable here, and there were no unnecessary duplicates."
