question,document,answer_score,answer_reasoning,trajectory_score,trajectory_reasoning
Should I still do the homework even if it's not needed for the certificate?,9f689c185f,good,"The agent answer matches the ground truth. It correctly says homework is not required for the certificate, is recommended for practice/reinforcement, and that the certificate depends on passing the Capstone project while homework points affect leaderboard rank. This includes the key information from the original answer.",good,"The search query was relevant to the question and included the key ideas of homework, certificate, and optionality. Only one search call was used, which is reasonable for this straightforward FAQ-style question. The tool call supported the final answer."
Why does the homework content keep changing before it’s released?,96286b4be4,good,"The agent answer matches the ground truth well. It includes the key condition that '[DRAFT]' means the homework is not ready, the two readiness criteria (form open and title no longer contains [DRAFT]), and the warning that early work is at your own risk because the final version may differ. This is substantively the same as the original answer.",good,"The single search query is directly relevant to the user's question and uses the main phrase from the question. One search call is reasonable, and there were no unnecessary or duplicate tool calls. The tool call supports the final answer."
How can I tell if a homework is actually ready to do?,96286b4be4,good,The agent answer matches the ground truth. It correctly states both readiness conditions: the form must be open and the title must not contain [DRAFT]. It also includes the important implication that [DRAFT] means not ready yet and that working early is at your own risk because content may change.,good,"The single search query directly used the question wording and was relevant. One search call was sufficient, with no unnecessary duplication. The tool call reasonably supported the final answer."
What does it mean when the homework title has [DRAFT] in it?,96286b4be4,good,"The agent answer matches the ground truth closely. It correctly states that '[DRAFT]' means the homework is not ready yet, that it is only ready when the homework form is open and the title no longer contains '[DRAFT]', and that the content may still change so working early is at the student's own risk. This preserves the key information from the original answer.",good,"The single search query was relevant and contained the key phrase '[DRAFT]' and the homework context. One tool call is reasonable for this question, and there were no unnecessary or duplicate searches. The tool call supports the final answer well."
Can I start working on homework early if it still says draft?,96286b4be4,good,"The agent answer matches the ground truth. It states that a homework title containing [DRAFT] means it is not ready, that it is only ready when the form is open and the title no longer contains [DRAFT], and that working early is at the student's own risk because the content may change. This preserves the key information from the original answer.",good,"The search query was relevant and included key terms from the question such as draft, homework, and early working. Only one search was used, which is reasonable for a straightforward FAQ-style question, and it supported the final answer."
When is it safe to assume the homework won’t change anymore?,96286b4be4,good,"The agent answer matches the ground truth: it states the two required conditions (form open and title without [DRAFT]) and correctly notes that until then the content can still change and working early is at the user's risk. It omits the explicit first sentence explaining that [DRAFT] means not ready yet, but the key information is preserved.",good,"The single search query was relevant and contained the main concepts from the question about when homework stops changing. One search call is reasonable, and there were no unnecessary duplicate calls. The tool use supports the final answer."
When is the llm-zoomcamp going to be offered again?,bd31146b0e,bad,"The agent answer does not match the ground truth. The correct answer is a specific date: Summer 2027. Instead, the agent says the FAQ does not list a specific next start date and gives unrelated information about current cohort materials and starting whenever you want. This misses the key information requested.",good,"The tool call was only loosely relevant. The search query asked about when llm-zoomcamp will be offered again, which is appropriate, but the agent failed to extract or provide the specific answer. Only one search call was made, which is reasonable, but it did not support the correct final response."
Do you know the next time this course will run?,bd31146b0e,good,The agent's answer exactly matches the ground truth key information: the next time the course will run is Summer 2027.,good,"The single search query was relevant to the question about the next course run and used appropriate scheduling keywords. One search call was sufficient, with no unnecessary repetition."
What’s the upcoming offering for this course?,bd31146b0e,bad,"The agent answer does not match the ground truth. The correct answer is 'Summer 2027,' but the agent instead says the course can be started anytime and refers to a current platform URL, explicitly noting that no future date was found. This misses the specific upcoming offering date required by the question.",bad,"The search query was too vague for the question and did not include the course name or a keyword like 'summer 2027'/'offering'. With only one generic search, it was unlikely to retrieve the specific FAQ detail. The tool use was not well targeted to support the correct answer."
When should I expect the next course session to start?,bd31146b0e,bad,"The agent did not match the ground truth. The correct answer is 'Summer 2027,' but the agent instead gave a generic statement that the FAQ does not specify a date and suggested checking elsewhere. This misses the exact expected start time.",bad,"The search query was relevant in a general sense, but it was too vague and did not include the key likely keywords from the question such as 'summer 2027' or 'next course session.' Only one search call was made, which is reasonable, but it did not effectively support the final answer."
"Is there a planned next run of the course, and when is it?",bd31146b0e,good,The agent’s answer matches the ground truth exactly in substance: it states that the course will next be offered in Summer 2027. This contains the key information asked for.,good,"The search query was relevant to the question and included the important concepts of the course's next run and scheduling. Only one search was used, which is reasonable for this simple factual question. The tool call supported the final answer."
Where can I find the course videos or lectures?,31456f4b5f,good,"The agent’s answer matches the ground truth well. It correctly says to use the LLM Zoomcamp GitHub repository as the main entry point, mentions opening lesson folders, notes that lesson pages have videos linked at the top, and advises using the GitHub repo first because it is easier to keep updated than the YouTube playlist. This preserves the key information from the original answer.",good,"The tool call was reasonable and relevant. The search query was broad but clearly targeted the user’s question about course videos/lectures. Only one search was needed, which is appropriate here, and there were no unnecessary duplicate calls."
Is there a central place I should start from for the lessons and videos?,31456f4b5f,good,"The agent’s answer matches the ground truth key points: it identifies the LLM Zoomcamp GitHub repository as the main entry point, says to open the lesson folders, notes that videos are linked at the top of each lesson page, and recommends following the GitHub repo first because it is more up to date than the YouTube playlist. It adds extra links and steps not present in the original answer, but these do not contradict the core response.",good,"The single search query was relevant to the user’s question and reasonably concise. It used the core idea of starting place for lessons/videos, and only one call was needed to support the answer. The query was a bit generic, but still acceptable and not excessive."
How do I get to the videos for each lesson in the course?,31456f4b5f,good,"The agent answer matches the ground truth well. It correctly says to use the LLM Zoomcamp GitHub repository as the main entry point, open the lesson folders, and that each lesson page has relevant videos linked at the top. It also includes the guidance to prefer the GitHub repo over the YouTube playlist because it is more up to date. The only minor difference is that it omits the image reference, which is not essential.",good,"The search query was relevant to the question and contained key terms like videos, lesson, and course. Only one search call was made, which is reasonable for a straightforward FAQ-style question. The tool use supported the final answer adequately."
Should I use the GitHub repo or the YouTube playlist to follow the course?,31456f4b5f,good,"The agent’s answer matches the ground truth: it recommends using the GitHub repo as the main entry point, explains that it is easier to keep updated than the YouTube playlist, and mentions opening lesson folders and using the videos linked at the top of each lesson page. This preserves the key guidance from the original answer.",good,"The single search query was relevant to the question and used important keywords like GitHub repo, YouTube playlist, and follow the course. Only one tool call was needed, and it supported the final answer without unnecessary duplication."
Where are the lecture links listed for every lesson page?,31456f4b5f,good,"The agent answer matches the ground truth: it says the lecture links are at the top of each lesson page in the LLM Zoomcamp GitHub repository, advises opening the lesson folders, and notes the GitHub repo is the main/up-to-date entry point over the YouTube playlist. That contains the key information from the original answer.",good,"The single search query was relevant to the question and asked about where lecture links are listed. One search call is reasonable for this straightforward FAQ-style question, and the result clearly supported the final answer."
