question,answer_llm,answer_orig,document
"I just found this course — am I still allowed to join, or is it too late?","Yes, you can still join. It’s not too late.

If you want a certificate, make sure to submit your project while submissions are still being accepted.","Yes, but if you want to receive a certificate, you need to submit your project while we’re still accepting submissions.",74eb249bbf
"If I join now, can I still get a certificate somehow?","Yes — if you join now, you can still get a certificate, but only if you submit your project while submissions are still being accepted.","Yes, but if you want to receive a certificate, you need to submit your project while we’re still accepting submissions.",74eb249bbf
What do I need to do to qualify for the certificate if I’m starting late?,"If you’re starting late, you can still get the certificate, but you need to:

1. **Submit your Capstone project while submissions are still open**
2. **Pass the Capstone project**
3. **Participate in the peer-review of three peers in your cohort**

Homework is not mandatory for the certificate.","Yes, but if you want to receive a certificate, you need to submit your project while we’re still accepting submissions.",74eb249bbf
Is there a deadline for submitting the project if I want the certificate?,"Yes. If you want a certificate, you need to submit your project while the course is still accepting submissions. After the submission form closes, you can no longer submit, and certificates aren’t available in self-paced mode.","Yes, but if you want to receive a certificate, you need to submit your project while we’re still accepting submissions.",74eb249bbf
"Can I enroll after the course has already started, and still count my project for certification?","Yes — you can still get a certificate if you miss homework, because homework is not mandatory. The certificate depends on passing the Capstone project and completing it with a live cohort.

If you enroll after the course has already started, the context says certificates are only awarded for finishing with a “live” cohort, and peer-review is only possible while the course is running. So I don’t know whether late enrollment would still count for certification beyond that.","Yes, but if you want to receive a certificate, you need to submit your project while we’re still accepting submissions.",74eb249bbf
"Do I actually need a confirmation email to join the LLM Zoomcamp, or am I already accepted?","You’re already accepted — you don’t need to wait for a confirmation email.

Registration is just to gauge interest, and it is not checked against a registered list. You can start learning and submitting homework while the form is open.",You don't need it. You're accepted. You can also just start learning and submitting homework (while the form is open) without registering. It is not checked against any registered list. Registration is just to gauge interest before the start date.,977bf7786c
"If I registered for the course, do I have to wait for an email before I can start the lessons and homework?","No. You don’t need to wait for a confirmation email. If you registered, you’re accepted, and you can start learning and submitting homework right away while the form is open.",You don't need it. You're accepted. You can also just start learning and submitting homework (while the form is open) without registering. It is not checked against any registered list. Registration is just to gauge interest before the start date.,977bf7786c
"Is there some approved list I need to be on, or can anyone just begin submitting homework while registration is open?","Anyone can start submitting homework while the submission form is open. There’s no approved registration list checked against submissions, and registration is just to gauge interest.",You don't need it. You're accepted. You can also just start learning and submitting homework (while the form is open) without registering. It is not checked against any registered list. Registration is just to gauge interest before the start date.,977bf7786c
What’s the point of the registration form if the course doesn’t check who registered?,"Registration is just to gauge interest before the start date. The course doesn’t check a registered list, so you can start learning and submitting homework while the form is open without needing a confirmation email.",You don't need it. You're accepted. You can also just start learning and submitting homework (while the form is open) without registering. It is not checked against any registered list. Registration is just to gauge interest before the start date.,977bf7786c
Can I start learning and turning in assignments right away without getting any extra confirmation after signing up?,"Yes. You don’t need any extra confirmation email after signing up.

You’re accepted, and you can start learning and submitting homework right away while the form is open. Registration is only used to gauge interest, and it is not checked against a registered list.",You don't need it. You're accepted. You can also just start learning and submitting homework (while the form is open) without registering. It is not checked against any registered list. Registration is just to gauge interest before the start date.,977bf7786c
Where do students actually join the office hours or live workshop if the Zoom link isn’t public?,"Students join via **YouTube Live**, not the Zoom link. The **video URL** is posted in the **announcements channel on Telegram and Slack** before the session starts, and it’s also available on the **DataTalksClub YouTube channel**. Questions should be submitted in **Slido**.","The zoom link is only published to instructors/presenters/TAs.

Students participate via YouTube Live and submit questions to Slido (link is pinned in the chat when live). The video URL should be posted in the [announcements channel on Telegram and Slack](https://t.me/dezoomcamp) before it begins. You can also watch live on the DataTalksClub [YouTube Channel](https://www.youtube.com/c/DataTalksClub).

Don’t post questions in chat as they may be missed if the room is very active.",489dd1c9d9
How can I ask questions during the live sessions if I’m not in the Zoom room?,"Students participate via YouTube Live and submit questions to Slido, with the Slido link pinned in the chat when live. Also check the announcements channel on Telegram and Slack for the live video URL before it starts.

","The zoom link is only published to instructors/presenters/TAs.

Students participate via YouTube Live and submit questions to Slido (link is pinned in the chat when live). The video URL should be posted in the [announcements channel on Telegram and Slack](https://t.me/dezoomcamp) before it begins. You can also watch live on the DataTalksClub [YouTube Channel](https://www.youtube.com/c/DataTalksClub).

Don’t post questions in chat as they may be missed if the room is very active.",489dd1c9d9
"Will the office hours stream link be shared somewhere before it starts, and where should I look for it?","Yes — the office hours stream/video link should be posted **before it begins** in the **announcements channel on Telegram and Slack**.

You can also watch it live on the **DataTalksClub YouTube channel**.","The zoom link is only published to instructors/presenters/TAs.

Students participate via YouTube Live and submit questions to Slido (link is pinned in the chat when live). The video URL should be posted in the [announcements channel on Telegram and Slack](https://t.me/dezoomcamp) before it begins. You can also watch live on the DataTalksClub [YouTube Channel](https://www.youtube.com/c/DataTalksClub).

Don’t post questions in chat as they may be missed if the room is very active.",489dd1c9d9
"Can I watch the live workshop on YouTube, or is it only for instructors and TAs?",Yes — students can watch the live workshop on YouTube Live. The Zoom link is only for instructors/presenters/TAs.,"The zoom link is only published to instructors/presenters/TAs.

Students participate via YouTube Live and submit questions to Slido (link is pinned in the chat when live). The video URL should be posted in the [announcements channel on Telegram and Slack](https://t.me/dezoomcamp) before it begins. You can also watch live on the DataTalksClub [YouTube Channel](https://www.youtube.com/c/DataTalksClub).

Don’t post questions in chat as they may be missed if the room is very active.",489dd1c9d9
"Should I use the chat to ask questions during office hours, or is there a better place to submit them?","If it’s during office hours or a live session, use **Slido** to submit questions — the link is usually pinned in the chat when the session is live. The context also says **don’t post questions in chat**, because they may get missed.

For regular course questions outside live sessions, ask in **Slack** and follow the asking questions guidelines.","The zoom link is only published to instructors/presenters/TAs.

Students participate via YouTube Live and submit questions to Slido (link is pinned in the chat when live). The video URL should be posted in the [announcements channel on Telegram and Slack](https://t.me/dezoomcamp) before it begins. You can also watch live on the DataTalksClub [YouTube Channel](https://www.youtube.com/c/DataTalksClub).

Don’t post questions in chat as they may be missed if the room is very active.",489dd1c9d9
"Where should I begin if I’m just starting LLM Zoomcamp, and what pages or repo should I look at first?","If you’re just starting LLM Zoomcamp, begin with these:

1. The **LLM Zoomcamp docs**:  
   https://datatalks.club/docs/courses/llm-zoomcamp/

2. The **general Zoomcamp logistics docs**:  
   https://datatalks.club/docs/courses/zoomcamp-logistics/

3. The **LLM Zoomcamp GitHub repository**:  
   https://github.com/DataTalksClub/llm-zoomcamp

The repo is the main entry point. Open the lesson folders there, and use the lesson pages to find the relevant videos at the top. If you’re unsure where to go next, follow the GitHub repo first since it’s easier to keep updated than the YouTube playlist.","Start with the [LLM Zoomcamp docs](https://datatalks.club/docs/courses/llm-zoomcamp/), the [general Zoomcamp logistics docs](https://datatalks.club/docs/courses/zoomcamp-logistics/), and the [LLM Zoomcamp GitHub repository](https://github.com/DataTalksClub/llm-zoomcamp).

You can start whenever you want. The videos and GitHub materials are available, and the deadlines are listed in the [course management platform](https://courses.datatalks.club/llm-zoomcamp-2026/).

A typical workflow is:

1. Watch the lesson videos.
2. Work through the lesson notebooks/code.
3. Read the homework instructions on GitHub.
4. Submit answers through the course platform before the deadline.

Homework is similar to the lesson flow, but uses a different dataset or slightly different task.",04919992b3
"What’s the usual weekly routine for this course — do I watch the lecture first, then do notebooks, then homework?","Yes — the usual workflow is:

1. Watch the lesson videos  
2. Work through the lesson notebooks/code  
3. Read the homework instructions on GitHub  
4. Submit the homework on the course platform before the deadline

So your understanding is right: lecture first, then notebooks, then homework.","Start with the [LLM Zoomcamp docs](https://datatalks.club/docs/courses/llm-zoomcamp/), the [general Zoomcamp logistics docs](https://datatalks.club/docs/courses/zoomcamp-logistics/), and the [LLM Zoomcamp GitHub repository](https://github.com/DataTalksClub/llm-zoomcamp).

You can start whenever you want. The videos and GitHub materials are available, and the deadlines are listed in the [course management platform](https://courses.datatalks.club/llm-zoomcamp-2026/).

A typical workflow is:

1. Watch the lesson videos.
2. Work through the lesson notebooks/code.
3. Read the homework instructions on GitHub.
4. Submit answers through the course platform before the deadline.

Homework is similar to the lesson flow, but uses a different dataset or slightly different task.",04919992b3
"Can I join and start the course at any time, or is there a fixed start date I need to wait for?","You can start whenever you want. The videos, GitHub materials, and homework are available, and you don’t need to wait for a registration confirmation.

However, if you want a certificate, you need to complete the course with a live cohort, not in self-paced mode.","Start with the [LLM Zoomcamp docs](https://datatalks.club/docs/courses/llm-zoomcamp/), the [general Zoomcamp logistics docs](https://datatalks.club/docs/courses/zoomcamp-logistics/), and the [LLM Zoomcamp GitHub repository](https://github.com/DataTalksClub/llm-zoomcamp).

You can start whenever you want. The videos and GitHub materials are available, and the deadlines are listed in the [course management platform](https://courses.datatalks.club/llm-zoomcamp-2026/).

A typical workflow is:

1. Watch the lesson videos.
2. Work through the lesson notebooks/code.
3. Read the homework instructions on GitHub.
4. Submit answers through the course platform before the deadline.

Homework is similar to the lesson flow, but uses a different dataset or slightly different task.",04919992b3
Where do I check the deadlines and submit my homework answers for LLM Zoomcamp?,"Check the **LLM Zoomcamp course management platform**:

https://courses.datatalks.club/llm-zoomcamp-2026/

That’s where you can see the **deadlines** and **submit your homework answers**.","Start with the [LLM Zoomcamp docs](https://datatalks.club/docs/courses/llm-zoomcamp/), the [general Zoomcamp logistics docs](https://datatalks.club/docs/courses/zoomcamp-logistics/), and the [LLM Zoomcamp GitHub repository](https://github.com/DataTalksClub/llm-zoomcamp).

You can start whenever you want. The videos and GitHub materials are available, and the deadlines are listed in the [course management platform](https://courses.datatalks.club/llm-zoomcamp-2026/).

A typical workflow is:

1. Watch the lesson videos.
2. Work through the lesson notebooks/code.
3. Read the homework instructions on GitHub.
4. Submit answers through the course platform before the deadline.

Homework is similar to the lesson flow, but uses a different dataset or slightly different task.",04919992b3
"Is the homework basically the same as the lesson work, or does it use a different dataset/task?","Yes — the homework is similar to the lesson flow, but it usually uses a different dataset or a slightly different task.","Start with the [LLM Zoomcamp docs](https://datatalks.club/docs/courses/llm-zoomcamp/), the [general Zoomcamp logistics docs](https://datatalks.club/docs/courses/zoomcamp-logistics/), and the [LLM Zoomcamp GitHub repository](https://github.com/DataTalksClub/llm-zoomcamp).

You can start whenever you want. The videos and GitHub materials are available, and the deadlines are listed in the [course management platform](https://courses.datatalks.club/llm-zoomcamp-2026/).

A typical workflow is:

1. Watch the lesson videos.
2. Work through the lesson notebooks/code.
3. Read the homework instructions on GitHub.
4. Submit answers through the course platform before the deadline.

Homework is similar to the lesson flow, but uses a different dataset or slightly different task.",04919992b3
How can I find my own entry on the leaderboard if I’m not sure which one is mine?,"Click the **“Jump to your record on the leaderboard”** link. Your account is assigned a random display name automatically, so that link will take you directly to your entry. If you want to see or change the name shown publicly, use **“Edit Course Profile.”**","When you set up your account, you are automatically assigned a random name, such as “Lucid Elbakyan.” Click on the ""Jump to your record on the leaderboard"" link to find your entry.

If you want to see what your Display name is, click on the ""Edit Course Profile"" button.

<{IMAGE:image_1}>

- **First field:** This is your nickname/displayed name. You can change it if you want to be known by your Slack username, GitHub username, or any other nickname of your choice. This is useful if you want to remain anonymous.
- **Second field:** Change this to your official name as in your identification documents—passport, national ID card, driver's license, etc. This is mandatory if you do not want ""Lucid Elbakyan"" on your certificate. This name will appear on your Certificate!",c2903069a0
"Why do I see a random name on the leaderboard, and can I change it?","You see a random name because the system automatically assigns a random display name when your account is created, such as “Lucid Elbakyan.”

Yes, you can change it:
- Open **Edit Course Profile**
- Change the **first field** to the nickname/display name you want shown on the leaderboard
- The **second field** is for your official name, which appears on your certificate

So the public leaderboard name is separate from your certificate name.","When you set up your account, you are automatically assigned a random name, such as “Lucid Elbakyan.” Click on the ""Jump to your record on the leaderboard"" link to find your entry.

If you want to see what your Display name is, click on the ""Edit Course Profile"" button.

<{IMAGE:image_1}>

- **First field:** This is your nickname/displayed name. You can change it if you want to be known by your Slack username, GitHub username, or any other nickname of your choice. This is useful if you want to remain anonymous.
- **Second field:** Change this to your official name as in your identification documents—passport, national ID card, driver's license, etc. This is mandatory if you do not want ""Lucid Elbakyan"" on your certificate. This name will appear on your Certificate!",c2903069a0
Where do I check what my displayed name is in the course profile?,Click the **“Edit Course Profile”** button. The first field is your **displayed/public name**.,"When you set up your account, you are automatically assigned a random name, such as “Lucid Elbakyan.” Click on the ""Jump to your record on the leaderboard"" link to find your entry.

If you want to see what your Display name is, click on the ""Edit Course Profile"" button.

<{IMAGE:image_1}>

- **First field:** This is your nickname/displayed name. You can change it if you want to be known by your Slack username, GitHub username, or any other nickname of your choice. This is useful if you want to remain anonymous.
- **Second field:** Change this to your official name as in your identification documents—passport, national ID card, driver's license, etc. This is mandatory if you do not want ""Lucid Elbakyan"" on your certificate. This name will appear on your Certificate!",c2903069a0
"If I want my certificate to show my real name instead of the default nickname, what should I update?",Update the **second field** in **Edit Course Profile** — that’s the **official name printed on your certificate**.,"When you set up your account, you are automatically assigned a random name, such as “Lucid Elbakyan.” Click on the ""Jump to your record on the leaderboard"" link to find your entry.

If you want to see what your Display name is, click on the ""Edit Course Profile"" button.

<{IMAGE:image_1}>

- **First field:** This is your nickname/displayed name. You can change it if you want to be known by your Slack username, GitHub username, or any other nickname of your choice. This is useful if you want to remain anonymous.
- **Second field:** Change this to your official name as in your identification documents—passport, national ID card, driver's license, etc. This is mandatory if you do not want ""Lucid Elbakyan"" on your certificate. This name will appear on your Certificate!",c2903069a0
"Can I use a Slack or GitHub handle as my course name, and which name ends up on the certificate?","Yes — you can use your Slack username, GitHub username, or another nickname as the **first field** in **Edit Course Profile** for the leaderboard/display name.

The **second field** is the **official name** that will appear on your certificate, and it should match your identification documents if you want it on the certificate.

So:
- **Slack/GitHub handle:** can be used as your public display name
- **Certificate name:** the name in the second field is what ends up on the certificate","When you set up your account, you are automatically assigned a random name, such as “Lucid Elbakyan.” Click on the ""Jump to your record on the leaderboard"" link to find your entry.

If you want to see what your Display name is, click on the ""Edit Course Profile"" button.

<{IMAGE:image_1}>

- **First field:** This is your nickname/displayed name. You can change it if you want to be known by your Slack username, GitHub username, or any other nickname of your choice. This is useful if you want to remain anonymous.
- **Second field:** Change this to your official name as in your identification documents—passport, national ID card, driver's license, etc. This is mandatory if you do not want ""Lucid Elbakyan"" on your certificate. This name will appear on your Certificate!",c2903069a0
"Can I take the course on my own schedule and still get the certificate, or is it only for the live cohort?",You can only get the certificate if you finish the course with the live cohort. The self-paced mode does **not** qualify for a certificate because you need to peer-review capstone projects while the course is running.,"No, you can only get a certificate if you finish the course with a ""live"" cohort.

We don't award certificates for the self-paced mode. The reason is you need to peer-review 3 capstone(s) after submitting your project.

You can only peer-review projects at the time the course is running; after the form is closed and the peer-review list is compiled.",69d122f12e
"If I study the course self-paced, will I be able to receive a certificate at the end?",No. You can only get a certificate if you finish the course with a live cohort. The self-paced mode does not include certificates.,"No, you can only get a certificate if you finish the course with a ""live"" cohort.

We don't award certificates for the self-paced mode. The reason is you need to peer-review 3 capstone(s) after submitting your project.

You can only peer-review projects at the time the course is running; after the form is closed and the peer-review list is compiled.",69d122f12e
Why don’t you give certificates for the self-paced version of the course?,"We don’t award certificates for the self-paced mode because you need to peer-review 3 capstone projects after submitting your own project. That peer-review is only possible while the live cohort is running, before the review form closes and the list is compiled.","No, you can only get a certificate if you finish the course with a ""live"" cohort.

We don't award certificates for the self-paced mode. The reason is you need to peer-review 3 capstone(s) after submitting your project.

You can only peer-review projects at the time the course is running; after the form is closed and the peer-review list is compiled.",69d122f12e
Do I have to finish the course while it’s running live to qualify for a certificate?,"Yes. To qualify for a certificate, you need to finish the course with a **live cohort** while the course is running, not in self-paced mode.","No, you can only get a certificate if you finish the course with a ""live"" cohort.

We don't award certificates for the self-paced mode. The reason is you need to peer-review 3 capstone(s) after submitting your project.

You can only peer-review projects at the time the course is running; after the form is closed and the peer-review list is compiled.",69d122f12e
"Is the peer-review part required for getting the certificate, and can that be done after the course ends?","Yes. The peer-review part is required for the certificate: you need to peer-review 3 fellow students’ capstones, and not doing so may prevent you from getting the certificate.

And no, this cannot be done after the course ends. You can only peer-review projects while the course is running, after the review list is released and before the form closes.","No, you can only get a certificate if you finish the course with a ""live"" cohort.

We don't award certificates for the self-paced mode. The reason is you need to peer-review 3 capstone(s) after submitting your project.

You can only peer-review projects at the time the course is running; after the form is closed and the peer-review list is compiled.",69d122f12e
Do I still qualify for the certificate if I missed the first homework?,"Yes — you still qualify for the certificate. You only need to pass the Capstone project; homework is not mandatory, though it helps with learning and leaderboard points.","Yes, you need to pass the Capstone project to get the certificate. Homework is not mandatory, though it is recommended for reinforcing concepts, and the points awarded count towards your rank on the leaderboard.",9f689c185f
Is the Capstone project enough to get the course certificate?,"Yes — you need to pass the Capstone project to get the certificate.

However, the capstone alone is **not enough** if you are doing the course self-paced: you can only get a certificate if you finish with a **live cohort**, because you also need to peer-review 3 capstone projects while the course is running.","Yes, you need to pass the Capstone project to get the certificate. Homework is not mandatory, though it is recommended for reinforcing concepts, and the points awarded count towards your rank on the leaderboard.",9f689c185f
